Full Text Tweet;Datum und Uhrzeit
Today we’re announcing a £640 million Nature for Climate Fund, which will help us plant new trees and protect our wildlife. ////Read more here: //https://t.co/wk7GxlxaH3 https://t.co/QWdh8HunNj;16-Nov-2019 (15:56:04.000000)
My thoughts are with all those affected by the serious fire in Bolton last night.////Thank you to emergency services for your brave response.////I have spoken with AFC Tony Hunter who is in charge at the scene, and we are doing everything to ensure they have all the required support.;16-Nov-2019 (10:40:31.000000)
Thanks to everyone across the UK who is supporting #ChildrenInNeed2019. This great cause represents much of what makes Britain special.;15-Nov-2019 (20:18:50.000000)
Another fantastic Friday in Britain.////Thanks to the team at the Coronation Candy factory for teaching me how to make rock today, and also to the Fleetwood Railway society.////I hope you all have a wonderful weekend. https://t.co/44Vq7CfSdv;15-Nov-2019 (19:08:05.000000)
It’s been so fantastic travelling around the country and meeting with so many of you. https://t.co/l7yNOI4Gq5;15-Nov-2019 (18:40:25.000000)
We want to unleash the potential of all our towns, cities and villages. ////Today we’ve announced a Conservative majority government will cut business rates for shops, cinemas and pubs. https://t.co/lgLkFlwqlr;15-Nov-2019 (18:10:52.000000)
We support an Australian style points based immigration system ////✔️Control of our borders//✔️Allows us to plan ahead for public services //✔️Welcomes the best and brightest to Britain;15-Nov-2019 (15:52:04.000000)
We need a fair and controlled immigration system. https://t.co/ZLCt8rFHqe;15-Nov-2019 (14:33:17.000000)
We need to get Brexit done so that we can support our brilliant high street businesses and unleash the potential of every town, city and village in the UK. 🇬🇧 https://t.co/1JoWNZcuxZ;15-Nov-2019 (13:30:34.000000)
I want a future where Brexit is done and we’re focusing on the issues that matter to you and your family.////A future with better hospitals, safer streets, world-class schools and a strong economy.;15-Nov-2019 (11:14:27.000000)
Today we’re announcing that a Conservative majority government will cut business rates for shops, cinemas and pubs.////We want to unleash the potential of all our towns, cities and villages. https://t.co/ISWdkXowFB;15-Nov-2019 (09:03:57.000000)
I’m enjoying getting out of Westminster and on the road for our campaign to get Brexit done! Let’s unleash the potential of this fantastic country 🇬🇧 https://t.co/usyEqd8vuM;15-Nov-2019 (07:16:39.000000)
Thank you to the amazing people I met today in Bristol, Taunton and Wells! ////This country is positive, enthusiastic and ready to get this thing done. Let's move on, and make the UK the best place to live, work, start a business, raise a family, and retire. 🇬🇧 https://t.co/VDFaDVfoj7;14-Nov-2019 (18:52:05.000000)
Hi folks, here's what I've been up to today. https://t.co/j4WyB2rsBO;14-Nov-2019 (18:29:04.000000)
Under my leadership, a majority Conservative government will implement an Australian style, points-based immigration system. https://t.co/cSxi1qxTdM;14-Nov-2019 (17:03:25.000000)
"Update on floods: about 818 properties flooded. Troops helping deploy over 20,000 sandbags to protect 1,000 properties at risk near river Don. Over 14,000 properties protected by @EnvAgency. COBR meeting shortly, more updates after, brilliant work from troops &amp; EA on the ground.";14-Nov-2019 (15:01:12.000000)
We need a fair and controlled Australian style points-based immigration system. https://t.co/VLX0Gw13al;14-Nov-2019 (13:22:15.000000)
When we leave the EU, we can implement an Australian style, points-based immigration system which is fair and controlled. ////We want to encourage and welcome highly skilled immigrants to Britain, whilst maintaining control so that we can plan and pay for public services.;14-Nov-2019 (10:14:29.000000)
Another busy day ahead. https://t.co/p2myvsS9nE;14-Nov-2019 (09:33:11.000000)
Huge thanks to our brilliant emergency responders and armed forces who are helping respond to the extreme weather. We are getting resources and help to those who need it.;13-Nov-2019 (18:40:35.000000)
I want a future where Brexit is done and we’re focusing on the issues that matter to you and your family. A future with better hospitals, safer streets, world-class schools and a strong economy. 🇬🇧;13-Nov-2019 (11:58:51.000000)
We're recruiting 20,000 more police and giving them the powers they need to keep you safe. https://t.co/hC2QPgrGrd;13-Nov-2019 (11:14:49.000000)
The Conservatives stand firmly behind the businesses and entrepreneurs who make our country great. https://t.co/JUoB6zUU47;13-Nov-2019 (07:13:02.000000)
For those who’ve noticed, this really is how I make my tea. It lets it brew and makes it stronger. ☕️//#partypoliticalbroadcast https://t.co/0r3SIx03Yf;12-Nov-2019 (19:35:38.000000)
I’ve answered a few questions about Brexit, the economy and Marmite.////Watch our first election broadcast now.////https://t.co/boH1GfJdJU;12-Nov-2019 (18:27:30.000000)
"Yesterday I popped into one of my first employers, the Express &amp; Star.////All of the staff there do a really top job. Thank you for your great welcome! ////Local newspapers are essential and are the political lifeblood of their communities. ////https://t.co/qRdDJ2QMAW";12-Nov-2019 (16:47:41.000000)
We will get Brexit done. ////We will get Parliament working for you again. ////We'll put uncertainty behind us so that families and businesses will be able to plan. ////Let's make 2020 the year of investment and growth, not the year of two more chaotic referendums.;12-Nov-2019 (15:56:38.000000)
Wishing Sikhs here in the UK and across the world, a very happy 550th Gurpurab of Guru Nanak Dev Ji, the founder of the Sikh faith. https://t.co/51JS0MICq8;12-Nov-2019 (14:53:43.000000)
I want a future where Brexit is done and we’re focusing on the issues that matter to you and your family.////A future with better hospitals, safer streets, world-class schools and a strong economy. https://t.co/E9jKoLldDs;12-Nov-2019 (13:34:19.000000)
"Under a majority Conservative Government there will be:////✔️ 50 million more appointments in GP surgeries every year.//✔️ 6,000 more GPs.//✔️ 6,000 more nurses, physiotherapists &amp; pharmacists. https://t.co/PPjFVGwqj8";12-Nov-2019 (12:02:33.000000)
You work hard and that's why we want to keep your taxes low. Labour's spending plans would hit you straight in the pocket.////https://t.co/D67Mc4MtOA;12-Nov-2019 (11:02:10.000000)
We're recruiting 20,000 more police and giving them the powers they need to keep you safe. ////https://t.co/AkIn2WCFSD;12-Nov-2019 (10:13:18.000000)
We can only invest in our great public services if we support the entrepreneurs, businesses and hardworking people who get up each day to build our strong economy.;12-Nov-2019 (08:23:07.000000)
Only a majority Conservative government can get Brexit done. https://t.co/UxaSkrEj0Y;12-Nov-2019 (07:28:06.000000)
As we remember the ultimate sacrifice made by our brave men and women for their country just over a century ago, it is right that we renew our commitment to the soldiers, sailors, marines, airmen and veterans of today. https://t.co/mOmMlKekeA;11-Nov-2019 (21:25:32.000000)
Meet the brilliant Arthur Waring, 91 years young. ////After the #ArmisticeDay service today in Wolverhampton I spent some time speaking with veterans at the local pub. What a privilege. https://t.co/gid5Sqnf9H;11-Nov-2019 (19:10:51.000000)
Let’s #GetBrexitDone and unleash Britain’s potential 🇬🇧 https://t.co/cBFi5t7a5M;11-Nov-2019 (18:17:25.000000)
A majority Conservative government will strengthen #OurNHS ////✔️ 50 million more GP appointments //✔️ 6,000 more GPs//✔️ 40 new hospitals//✔️ A skills based immigration system;11-Nov-2019 (15:10:18.000000)
We will make more GP appointments available so that you can receive the care that you need. ////Read more: https://t.co/pthI84u6q9 https://t.co/pjiObX0wMz;11-Nov-2019 (14:23:58.000000)
"The British people have had enough delay &amp; uncertainty. I want us to #GetBrexitDone and spend next year focusing on the issues that matter - tackling violent crime, investing in our NHS &amp; schools, and strengthening our economy.";11-Nov-2019 (13:34:44.000000)
Only a Conservative majority can get Brexit done by the end of January with a deal that's agreed and ready to go. https://t.co/u5BUvfG3Wk;11-Nov-2019 (12:51:19.000000)
Honoured to meet Fred Bunce, Korean war veteran, at a service in Wolverhampton this morning. Fred continues to serve his community with the Royal British Legion. Today we remember all those who have sacrificed so much for our freedom. #ArmisticeDay https://t.co/XIoPRRR3KG;11-Nov-2019 (11:52:04.000000)
At 11am I will be observing two minutes of silence to remember all those who gave their lives so that we could live in peace. #ArmisticeDay #TwoMinuteSilence https://t.co/cFHQcXkLqj;11-Nov-2019 (10:30:43.000000)
It's so important that we continue to support our veterans and thank them for all they've done for us. ////https://t.co/8dR60AsUL9;11-Nov-2019 (09:54:28.000000)
Since Thursday last week, I’ve received regular briefings from officials on the flooding that’s occurred across Yorkshire and the Midlands.////Read my update: https://t.co/CgoZj5uDBc;10-Nov-2019 (17:22:34.000000)
We are introducing a new Veterans' Railcard, giving those who've served our country a third off their travel. We will continue to support veterans and recognise their service to our country.////https://t.co/ZA7e8wTYcz;10-Nov-2019 (16:30:38.000000)
The great new deal we've done with our European friends takes us out of the EU in January. Let’s build a new relationship based on free trade not political alignment. https://t.co/I9KB6QxZK0;10-Nov-2019 (16:15:42.000000)
We will remember them. #LestWeForget https://t.co/CIAXUFHgSg;10-Nov-2019 (11:46:15.000000)
Today I will be thinking of the men and women who, over the centuries, have given so much to protect our country. I will especially remember the men and women who gave the ultimate sacrifice in war, so that today we can live in peace.//#RemembranceSunday;10-Nov-2019 (08:53:18.000000)
Under a majority Conservative Government there will be 6,000 more doctors to help reduce waiting times around the country. https://t.co/fTdAGtIjZN;09-Nov-2019 (18:10:43.000000)
Selling poppies for @PoppyLegion in Uxbridge this morning. We must always remember and honour the men and women who have given so much to protect our country. #PoppyAppeal https://t.co/YI4e7lvTS3;09-Nov-2019 (14:10:30.000000)
👍 We back our armed forces.////👍 We back our police.////👍 #VoteConservative on December 12th. https://t.co/copLlS3sxC;08-Nov-2019 (21:51:00.000000)
Today we've announced our plan to accelerate the visas for nurses that want to come and work in this country, once we #GetBrexitDone.////We are the party of the NHS. https://t.co/kF6HXiEWeQ;08-Nov-2019 (21:03:00.000000)
When we #GetBrexitDone we'll be able to deliver on the people's priorities like education.////#VoteConservative on December 12th. https://t.co/4O497goCj0;08-Nov-2019 (19:10:14.000000)
It's time to #GetBrexitDone. ////#VoteConservative on December 12. https://t.co/oXPG9urbY4;08-Nov-2019 (17:06:42.000000)
Our deal will allow us to #GetBrexitDone and unleash Britain’s potential. https://t.co/8KmvpvnqVm;08-Nov-2019 (15:20:29.000000)
I can’t wait to share with you all our positive vision for Britain! We want to #GetBrexitDone so we can unleash the potential of this great country 🇬🇧 #VoteConservative https://t.co/5FptOLnn8s;08-Nov-2019 (12:44:22.000000)
"Terrific time on the trail in Teesside, Scotland &amp; Northern Ireland yesterday. Everyone is rightfully optimistic about the future we can all have. We just need to end the gridlock in Parliament. A @Conservatives majority will #GetBrexitDone &amp; get Parliament working again for you. https://t.co/tdYOFQ9FB7";08-Nov-2019 (08:23:50.000000)
"Awful to see the terrible flooding across the North of England. Thank you to the emergency staff &amp; volunteers helping families through this difficult time. Pls follow @metoffice for updates in your area or call the flood hotline: 0345 988 1188.";08-Nov-2019 (07:34:58.000000)
"Very sad news from Uxbridge last night. My thoughts are with the victims friends &amp; family. https://t.co/SPz5TpXCVC";08-Nov-2019 (07:18:04.000000)
People across the country, just like here on Teesside, want me to #GetBrexitDone.////#VoteConservative on December 12th. https://t.co/DtLHwx37lO;07-Nov-2019 (17:15:13.000000)
Visiting Roseisle distillery in Scotland with our fantastic candidate @Douglas4Moray. ////The Scottish whisky industry supports over 10,000 jobs in Scotland, and over 42,000 jobs across the UK. We will continue to back these brilliant businesses that keep our economy growing. https://t.co/BAqoRRmq6Y;07-Nov-2019 (15:04:04.000000)
Fantastic to visit Tetley Tea factory this morning in Stockton and meet with the team here. We want to make this country the best place in the world to do business so that you and your family can get ahead #VoteConservative https://t.co/JDyNT6Pw42;07-Nov-2019 (11:02:38.000000)
Morning folks! Fantastic coffee to start day two of our campaign ☕️ https://t.co/lunbKMT5xa;07-Nov-2019 (09:15:53.000000)
Let’s unleash the potential of this great country 🇬🇧 //#VoteConservative https://t.co/yNRneqCYqD;07-Nov-2019 (08:40:00.000000)
Just leaving Downing Street to take our message around the country.////See you out there folks! https://t.co/6C9EGPnPmI;07-Nov-2019 (08:00:00.000000)
Thank you Birmingham! Tomorrow I'll hit the campaign trail and pitch our positive plan to get Brexit done and unleash Britain's potential 🇬🇧 https://t.co/kFRe8EKhDr;06-Nov-2019 (22:04:02.000000)
Let’s unleash the potential of this great country 🇬🇧 #VoteConservative https://t.co/O9IGZeo3ID;06-Nov-2019 (21:27:55.000000)
Brilliant Birmingham reception to our plan to #GetBrexitDone and unleash Britain's potential.////Now I'll take our message across the whole country, and I hope very much that you'll stand with us. https://t.co/ziSukAfLvm;06-Nov-2019 (21:04:15.000000)
✅ Get Brexit Done.//✅ Unleash Britain's Potential.//🗳 Vote Conservative. https://t.co/sE7looBvZy;06-Nov-2019 (20:16:03.000000)
🔴 Join me LIVE for the Conservative campaign launch https://t.co/odbarwVTGw;06-Nov-2019 (19:34:55.000000)
Adding the finishing touches to my speech for tonight. Can't wait to launch our campaign in Birmingham! #GetBrexitDone 🇬🇧 https://t.co/59NGAkgMYC;06-Nov-2019 (18:56:02.000000)
Only a Conservative majority government can get Brexit done.////Join me now 👉 https://t.co/UjwK6hEw1V//#GetBrexitDone //#VoteConservative https://t.co/RTwImDLQSY;06-Nov-2019 (15:15:04.000000)
Only a Conservative majority will mean that we can #GetBrexitDone.////Join me ▸ https://t.co/UjwK6hEw1V https://t.co/XBfzPbfzT7;06-Nov-2019 (13:40:58.000000)
We will have a General Election on December 12th. It's now up to you, the great British public, to make your voice heard. ////Do you want to #GetBrexitDone or have two more referendums next year with Corbyn? https://t.co/orPEc3jwE1;06-Nov-2019 (11:44:55.000000)
On my way to see Her Majesty the Queen https://t.co/SRUowknlYI;06-Nov-2019 (10:13:52.000000)
Let’s #GetBrexitDone and take this country forward 🇬🇧 ////https://t.co/z6ys7iX3nP;06-Nov-2019 (08:44:55.000000)
A new majority Conservative government in a new Parliament will #GetBrexitDone.////#VoteConservative https://t.co/jQrw4jTnqw;05-Nov-2019 (22:31:37.000000)
Jeremy Corbyn wants to have another EU Referendum and debate Brexit for years.  ////I want us to #GetBrexitDone so that we can get on with delivering on Britain’s priorities: safer streets, better hospitals and improved schools. #VoteConservative;05-Nov-2019 (14:51:11.000000)
Let's take our country forward and deliver on the people's priorities 🇬🇧 #GetBrexitDone https://t.co/5kioi2PzhU;05-Nov-2019 (09:33:57.000000)
Tonight I have written to Jeremy Corbyn to ask him if he has made up his mind on Brexit. ////The British people deserve to know what they are voting for on December 12th. https://t.co/abs3jjoOIP;04-Nov-2019 (21:24:01.000000)
Jeremy Corbyn wants to have another EU Referendum and debate Brexit for years. ////I want us to #GetBrexitDone so that we can get on with delivering on Britain’s priorities: safer streets, better hospitals and improved schools. #VoteConservative;04-Nov-2019 (08:40:06.000000)
Hats off to South Africa who were just rocklike in defence today but @EnglandRugby can hold their heads high after an amazing tournament. #RWCFinal #ENGvRSA;02-Nov-2019 (11:11:49.000000)
Come on England! #ENGvRSA #RWCFinal https://t.co/EnA97AQpW2;02-Nov-2019 (10:45:18.000000)
It’s 100 days since I became Prime Minister 🇬🇧 https://t.co/OfZMv9paVM;01-Nov-2019 (18:14:13.000000)
"Looking forward to making the positive case to the country that we should #GetBrexitDone &amp; deliver on the people’s priorities - #OurNHS, schools, tackling crime &amp; the cost of living 🇬🇧 https://t.co/40x0tjTCU9";01-Nov-2019 (17:20:52.000000)
Go for it England. #RWC2019  #ENGvRSA #CarryThemHome 🏴󠁧󠁢󠁥󠁮󠁧󠁿 https://t.co/UAw2ykTdkq;01-Nov-2019 (17:06:57.000000)
Let's take our country forward and deliver on the people's priorities 🇬🇧 https://t.co/KK5Nmmyq89;01-Nov-2019 (15:10:54.000000)
Not the result we wanted from the Bronze Final, but @WelshRugbyUnion have had a great tournament. We're proud of you! #RWC2019 #NZLvWAL;01-Nov-2019 (11:41:52.000000)
"I want us to #GetBrexitDone so that we can deliver on the priorities of the British people, like investing in our NHS &amp; improving our schools. 🇬🇧 https://t.co/KyVTVquPCK";01-Nov-2019 (08:10:57.000000)
Hi folks, here’s why we’re having an election. https://t.co/ch61YNJhTa;31-Oct-2019 (18:16:54.000000)
We need a new Parliament to #GetBrexitDone 🇬🇧 https://t.co/WDWqiIPhCl;31-Oct-2019 (16:59:53.000000)
My top priority remains, as it always has been, to #GetBrexitDone – and to get it done with our new deal. We need to ensure our country has a new, functioning majority government that can deliver on the issues that matter to the British people.;31-Oct-2019 (13:37:17.000000)
We need to #GetBrexitDone so the country can move on 🇬🇧 https://t.co/daE4UOyO0U;30-Oct-2019 (16:54:00.000000)
We’re putting more money into the NHS than ever before #OurNHS https://t.co/sftFw0BlOJ;30-Oct-2019 (11:12:11.000000)
Let's take our country forward and deliver on the people's priorities 🇬🇧 https://t.co/bRTWy3Iyt9;30-Oct-2019 (07:58:32.000000)
"Parliament &amp; Jeremy Corbyn have blocked everything — we need a new Parliament so we can #GetBrexitDone and the country can #MoveOn to focus on the cost of living, NHS, clean energy, violent crime and higher pay #BritainDeservesBetter";29-Oct-2019 (19:22:49.000000)
Isabelle Bibb is one of thousands of people with cystic fibrosis who will benefit from new treatment on the NHS. https://t.co/VnkCJJ4dG1;29-Oct-2019 (16:11:51.000000)
We’re recruiting 20,000 police officers. Together we will cut crime, get criminals off the streets and keep people safe. https://t.co/BC1IpgAmyn;29-Oct-2019 (08:36:00.000000)
The death of Baghdadi is an important moment in our fight against terror but the battle against the evil of Daesh is not yet over.////We will work with our coalition partners to bring an end to the murderous, barbaric activities of Daesh once and for all.;27-Oct-2019 (14:33:51.000000)
We’re putting more money into the NHS than ever before. I’m making sure it reaches the frontline and makes a real difference to patients. https://t.co/eGKvh4kbfn;27-Oct-2019 (11:55:13.000000)
To everyone celebrating Diwali here in the UK and around the world, I want to wish you all a happy Diwali and a joyful and successful new year. Shubh Diwali! https://t.co/kWi6OHo8wj;26-Oct-2019 (20:26:38.000000)
Immense effort by @EnglandRugby, many congratulations to the whole team. Now for the final! #ENGvNZL #RWC19 https://t.co/7qbTsnHl11;26-Oct-2019 (10:11:36.000000)
We think every child has the right to a superb education in this country. https://t.co/q8CL1ROEpp;26-Oct-2019 (09:02:07.000000)
Hi folks - here's what's going on. ////If you want to help me #GetBrexitDone then please sign up here to volunteer: https://t.co/K7s0eQXw5c https://t.co/6L2l7KVpzY;25-Oct-2019 (16:48:42.000000)
We’re investing more money into #OurNHS to upgrade hospitals and improve frontline patient care across the country. https://t.co/Qs6VJXHVZc;25-Oct-2019 (15:07:43.000000)
Meeting patients and staff at Milton Keynes University Hospital. #OurNHS https://t.co/qkpWcdGoBe;25-Oct-2019 (11:33:18.000000)
If this Parliament can’t get Brexit done, then we need one that will. I’m determined to lead this country forward 🇬🇧 https://t.co/uzUQGo1g8G;24-Oct-2019 (20:03:32.000000)
Hi folks, as you all know we need to get Brexit done so we can move forward as a country. Either with this Parliament or with a new one – chosen by you, the voters. 🇬🇧 https://t.co/uRT2DwnUGZ;24-Oct-2019 (18:09:28.000000)
I have written to Jeremy Corbyn: this Parliament must get Brexit done now or a NEW Parliament must get Brexit done so the country can move on https://t.co/PekfFRsR9F;24-Oct-2019 (16:06:36.000000)
This is fantastic news for those suffering from this terrible disease. I pay tribute to those who have campaigned so passionately and tirelessly on this issue – your efforts have made all the difference. https://t.co/CdbhfvO1nb;24-Oct-2019 (11:18:28.000000)
We need to #GetBrexitDone 🇬🇧 https://t.co/NbYPgQPk45;24-Oct-2019 (09:07:39.000000)
"I’m appalled by this tragic incident in Essex. I am receiving regular updates and the Home Office will work closely with Essex Police as we establish exactly what has happened. My thoughts are with all those who lost their lives &amp; their loved ones.";23-Oct-2019 (09:25:29.000000)
Our new deal means we can leave without disruption and deliver on the priorities of the British people – investing in our NHS, tackling crime and improving our schools. #GetBrexitDone 🇬🇧 https://t.co/7XCYo4pWrz;22-Oct-2019 (16:36:15.000000)
Our new deal means we can leave without disruption and deliver on the priorities of the British people – investing in our NHS, tackling crime and improving our schools. https://t.co/TbjtgkcwCx;22-Oct-2019 (16:02:57.000000)
"Honoured to meet with ex-Col David Richmond today. He is leading the Office for Veterans' Affairs @veteransgovuk, which will take care of our heroes &amp; ensure they have all they need. As PM I will always back our Armed Forces 🇬🇧 https://t.co/MChM9Is8iw";22-Oct-2019 (15:26:38.000000)
We’ve got a great new deal that takes back control. It’s time to #GetBrexitDone so we can move on to other priorities like the cost of living, the NHS, violent crime and our environment 🇬🇧 https://t.co/hdHQQJpZDf;22-Oct-2019 (14:55:01.000000)
The public doesn’t want any more delays. Let’s get Brexit done on October 31st and move this country forward. #GetBrexitDone 🇬🇧 https://t.co/Uo1Nn3GMOE;22-Oct-2019 (11:39:45.000000)
It’s time to #GetBrexitDone and get on with delivering on Britain’s priorities: safer streets, better hospitals and improved schools 🇬🇧 #LeaveOct31st #GetBrexitDone https://t.co/B8egCltoCm;22-Oct-2019 (09:10:34.000000)
Let’s go for a deal that can heal this country and allows us to believe in ourselves once again as an open, generous, global, outward-looking and free-trading United Kingdom. #GetBrexitDone 🇬🇧 https://t.co/VJSOLaoC6D;22-Oct-2019 (06:53:56.000000)
This new deal means we can take back control of our laws, borders, money and trade. #GetBrexitDone 🇬🇧 https://t.co/tfAzPzOGxO;21-Oct-2019 (17:23:44.000000)
Let’s go for a deal that can heal this country and allows us to believe in ourselves once again as an open, generous, global, outward-looking and free-trading United Kingdom. #GetBrexitDone 🇬🇧 https://t.co/lWLM6ZXNBG;21-Oct-2019 (11:12:14.000000)
We’ve got a great new deal that takes back control. It’s time to #GetBrexitDone so we can move on to other priorities like the cost of living, the NHS, violent crime and our environment 🇬🇧 https://t.co/QIuW5V4q0d;21-Oct-2019 (09:42:52.000000)
It’s time to get #GetBrexitDone and get on with delivering on Britain’s priorities: safer streets, better hospitals and improved schools 🇬🇧 https://t.co/BXgMKzXMoy;21-Oct-2019 (07:50:47.000000)
Let’s go for a deal that can heal this country and allows us to believe in ourselves once again as an open, generous, global, outward-looking and free-trading United Kingdom. #GetBrexitDone 🇬🇧 https://t.co/uRDFrd76lK;19-Oct-2019 (12:06:16.000000)
Let's come together and get Brexit done 🇬🇧 #GetBrexitDone https://t.co/PC1UNo0E6W;19-Oct-2019 (10:03:49.000000)
Now it's time for MPs to #GetBrexitDone 🇬🇧 https://t.co/24DL8BlkE3;18-Oct-2019 (18:16:41.000000)
I want us to #GetBrexitDone on Saturday, so that we can move on to other priorities like the cost of living, the NHS, tackling crime and protecting our environment. https://t.co/oZ896WglNn;18-Oct-2019 (17:49:14.000000)
This new deal ensures that we #TakeBackControl of our laws, borders, money and trade 🇬🇧  #GetBrexitDone https://t.co/MPIOZXhTCa;18-Oct-2019 (13:00:04.000000)
This is our chance to #GetBrexitDone 🇬🇧 https://t.co/4OC6TwZuXO;18-Oct-2019 (12:13:06.000000)
This new deal ensures that we #TakeBackControl of our laws, borders, money and trade 🇬🇧 #GetBrexitDone https://t.co/JkKelIyLKV;18-Oct-2019 (10:02:13.000000)
