Full Text Tweet;Datum und Uhrzeit
It is hard to find the words to express my debt to the NHS for saving my life.////The efforts of millions of people across this country to stay home are worth it. Together we will overcome this challenge, as we have overcome so many challenges in the past. #StayHomeSaveLives https://t.co/HK7Ch8BMB5;12-Apr-2020 (14:00:29.000000)
I’d like to say thank you to all the brilliant NHS staff taking care of me and others in this difficult time. You are the best of Britain. ////Stay safe everyone, and please remember to stay at home to protect the NHS and save lives.;06-Apr-2020 (12:21:28.000000)
Last night, on the advice of my doctor, I went into hospital for some routine tests as I’m still experiencing coronavirus symptoms. I’m in good spirits and keeping in touch with my team, as we work together to fight this virus and keep everyone safe.;06-Apr-2020 (12:20:58.000000)
Thank you for doing your bit in the fight against #coronavirus. ////Stay home, protect the NHS and save lives. // //#StayHomeSaveLives https://t.co/5p2dsucMbK;05-Apr-2020 (17:30:00.000000)
We can beat this together. ////#StayHomeSaveLives https://t.co/uXZzNUXhJ8;05-Apr-2020 (10:20:00.000000)
Thank you to everyone who is saving lives by staying at home this weekend. ////I know it's tough, but if we all work together and follow the guidance we will beat #coronavirus.////#StayHomeSaveLives;05-Apr-2020 (08:38:52.000000)
"I have just spoken to @Keir_Starmer &amp; congratulated him on becoming Labour leader. We agreed on the importance of all party leaders continuing to work constructively together through this national emergency. I have invited him and other opposition leaders to a briefing next week.";04-Apr-2020 (11:16:34.000000)
I have written to all leaders of opposition parties to invite them to work together at this moment of national emergency. https://t.co/HgEsMo3DO2;04-Apr-2020 (08:48:21.000000)
This country has made a huge effort, a huge sacrifice, and done absolutely brilliantly well in delaying the spread of the virus. ////But in this fine weather, please don't be tempted to break the regulations. I urge everyone to stay at home, protect the NHS and save lives.;04-Apr-2020 (08:09:40.000000)
We must now come together to protect our NHS and to save many, many thousands of lives. ////#StayHomeSaveLives https://t.co/SeVMKTVpJB;03-Apr-2020 (13:52:15.000000)
Another quick update from me on our campaign against #coronavirus.////You are saving lives by staying at home, so I urge you to stick with it this weekend, even if we do have some fine weather.////#StayHomeSaveLives https://t.co/4GHmJhxXQ0;03-Apr-2020 (11:50:35.000000)
Thank you to everyone involved in building the new NHS Nightingale Hospital over the past fortnight.////This immense effort means we will have an extra 4,000 beds to care for #coronavirus patients. https://t.co/wbLOSmtaAP;03-Apr-2020 (10:51:44.000000)
Thank you to the NHS and all of our critical workers for all you are doing to fight #coronavirus. You really are an inspiration. #ClapForOurCarers #ThankYouThursday #ClapForKeyWorkers https://t.co/SRm2cAkAnQ;02-Apr-2020 (19:29:54.000000)
Stay at home, protect the NHS, save lives. ////#StayHomeSaveLives https://t.co/3w3D8UcuUT;02-Apr-2020 (10:08:33.000000)
Yesterday's data showed more people were using transport than in previous days. ////Please do not leave your house unless absolutely necessary. It really will save lives. ////#StayHomeSavesLives;02-Apr-2020 (09:05:20.000000)
Here's an update to bring you up to speed on some of the things that we are doing to protect our NHS.////We will beat coronavirus together by staying at home, protecting our NHS and saving lives. ////#StayHomeSaveLives https://t.co/FOYfvzlQPC;01-Apr-2020 (19:34:43.000000)
I'm staying at home to protect our NHS and save lives.////If we all follow government advice, we can beat #coronavirus together.////#StayHomeSaveLives;01-Apr-2020 (13:02:39.000000)
Thank you Kaydyn for staying at home. Glad the food box arrived. ////We’re doing everything we can to protect people like you.////#StayHomeSaveLives https://t.co/AA74m4StMw;31-Mar-2020 (17:46:13.000000)
This morning I chaired the first ever digital Cabinet. ////Our message to the public is: stay at home, protect the NHS, save lives. #StayHomeSaveLives https://t.co/pgeRc3FHIp;31-Mar-2020 (13:52:35.000000)
Thank you to the 20,000 former staff coming back to the NHS.////And thank you to the 750,000 people who have volunteered to help vulnerable people through this crisis.////We will get through it together.////#Coronavirus #StayHomeSaveLives;30-Mar-2020 (15:03:26.000000)
I’ve been working from home and continuing to lead the government’s response to coronavirus.////Stay at home, protect the NHS, and save lives. #StayHomeSaveLives https://t.co/tYqHYa0Sfy;30-Mar-2020 (11:04:14.000000)
Thanks to everyone who has been staying at home.////By delaying the spread of the disease we can reduce the pressure on our NHS, and that's how we hope to save many thousands of lives.////#StayHomeSaveLives https://t.co/kxdqItMYSE;29-Mar-2020 (19:02:34.000000)
Thank you to everybody who’s doing what I’m doing, working from home and stopping the virus spreading from household to household.////We’re going to beat it, and we’re going to beat it together. Stay at home, protect the NHS and save lives. #StayHomeSaveLives;28-Mar-2020 (12:05:22.000000)
Over the last 24 hours I have developed mild symptoms and tested positive for coronavirus.////I am now self-isolating, but I will continue to lead the government’s response via video-conference as we fight this virus.////Together we will beat this. #StayHomeSaveLives https://t.co/9Te6aFP0Ri;27-Mar-2020 (11:15:28.000000)
"On behalf of the whole country, I want to thank all the incredible nurses, doctors, NHS support staff &amp; carers who are working flat out to fight coronavirus 👏 #ClapForOurCarers #ClapForNHS////To help them, and protect the NHS, we need everyone to stay at home #StayHomeSaveLives https://t.co/kpdQ5KHQiy";26-Mar-2020 (20:19:32.000000)
Governments around the world must step up to help us defeat #coronavirus.////I’ve announced a further £210m of aid funding for vaccine research following today's G20 call, meaning the UK is going above and beyond in the search for a vaccine. ////➡️ https://t.co/lkk9nF2hKP https://t.co/xLahX2PYyB;26-Mar-2020 (16:35:15.000000)
I want to thank all of our brilliant public servants, not only in the NHS, but also in the Police, Armed Forces, local government, social care and elsewhere - you have shown extraordinary courage in facing this national emergency. Our country owes you a huge debt of gratitude. https://t.co/ExjgZ2HhYM;26-Mar-2020 (07:57:01.000000)
Thank you to the 405,000 incredible NHS volunteer responders who have signed up today.////If you want to sign up, follow this link: https://t.co/iD28UgOrZR https://t.co/Ii8NvVy1TK;25-Mar-2020 (21:50:19.000000)
We’re taking the right measures at the right time. It is vital to slow the spread of the disease, so stay at home, protect the NHS and save lives. #StayHomeSaveLives;25-Mar-2020 (19:40:28.000000)
🏠 Stay at home//🏥 Protect the NHS//♥ Save lives////Millions of people are already following the rules, and helping to save lives. Please play your part by staying at home. ////#StayHomeSaveLives////https://t.co/kdHUGOW5he https://t.co/bGGxx8rK9z;25-Mar-2020 (13:33:13.000000)
Your NHS needs you. If you can help the NHS during the #coronavirus pandemic, visit ⬇️//https://t.co/y4rbSUuu4J;25-Mar-2020 (11:38:05.000000)
Fantastic to see so many people doing their bit in the fight against #coronavirus////If you want to volunteer to help the NHS, you can do so here: https://t.co/iD28UgOrZR https://t.co/F6QUMU3lcd;25-Mar-2020 (09:53:39.000000)
Thank you to the 11,788 former NHS staff who have answered the call to support the health service as it responds to #coronavirus.////Now people must stay at home to support you, so that you can be there to support us in our hour of need. #StayHomeSaveLives;24-Mar-2020 (20:49:36.000000)
Our athletes are committed to being the best in their field- day in, day out. To see their chance at Olympic glory postponed is hugely disappointing. But they recognise that this means more. We must now show our dedication by staying at home, protecting the NHS and saving lives. https://t.co/vvrvi8muHm;24-Mar-2020 (20:03:22.000000)
This morning, I chaired the first ever video conference Cabinet meeting.// //We must all do our bit to stop the spread of coronavirus, protect our NHS and save lives. #StayHomeSaveLives// //https://t.co/Eew4i0Wr5q https://t.co/LkWYYnMXnq;24-Mar-2020 (18:42:16.000000)
At this moment of national emergency you must stay at home, protect the NHS and save lives. ////#StayHomeSaveLives https://t.co/nb2baBmMJr;24-Mar-2020 (14:36:17.000000)
Please join me for an important update on #coronavirus #StayHomeSaveLives https://t.co/QSlIOIaYsF;23-Mar-2020 (20:31:22.000000)
These are the people who are saving lives. ////Stay at home, protect the NHS, and save lives.  ////#StayHomeSaveLives https://t.co/KGihWbNHTX;23-Mar-2020 (15:07:16.000000)
If you don’t follow these instructions, you are putting people’s lives at risk: ////You must stay at home to protect our NHS and save lives. ////#StayHomeSaveLives;23-Mar-2020 (08:40:46.000000)
Stay two metres apart.////It's not such a difficult thing.////Do it. It really will save lives. ////#coronavirus #StaySafeSaveLives https://t.co/SSbrwxjEar;22-Mar-2020 (20:04:36.000000)
We need you to do your bit to help us beat #coronavirus////Please RT.////#StayHomeSaveLives https://t.co/mSGgGsQDSH;22-Mar-2020 (15:39:46.000000)
We will get through this together, and we will beat the virus. ////To win this fight, we need everyone to follow our advice: as far as possible, we want you to stay at home. The more effectively everyone does this, the faster this country will recover.////#StayHomeSaveLives;22-Mar-2020 (13:56:23.000000)
This Mother’s Day, everyone should stop #coronavirus spreading.////Keep your mum safe. Stay at home.////#StayHomeSaveLives #MothersDay https://t.co/6OQ7cGm57w;22-Mar-2020 (12:41:17.000000)
Thank you @AthertonNWales! https://t.co/On4qnTHaOq;22-Mar-2020 (11:00:33.000000)
Thank you @MariaCaulfield! https://t.co/Fx1U7KiVub;21-Mar-2020 (20:47:34.000000)
Our amazing NHS staff want to be there to help you and your loved ones over the coming weeks and months.////You can help them right now by staying inside. #StayHomeSaveLives https://t.co/qhfdh51HDk;21-Mar-2020 (18:57:02.000000)
Josephine sets a great example to us all by postponing her birthday party until we have sent coronavirus packing.////Together we can beat this. In the meantime let's all wish her happy birthday (twice) whilst washing our hands. #BeLikeJosephine #StayHomeSaveLives https://t.co/xmDOw60hhV https://t.co/yl7uxe9lhh;21-Mar-2020 (12:58:23.000000)
The coming months will be challenging, but I want to assure businesses that we are with them every step of the way.////Stand by your employees, stand by your workers, because we will stand by you. https://t.co/IqTDLOmBve;21-Mar-2020 (11:54:35.000000)
We want to protect you. But to do so, we need you to do your bit. #StayHomeSaveLives https://t.co/oSAzFF5AWk;21-Mar-2020 (08:30:52.000000)
To those going against the advice we're getting from our experts, you're not only putting your own life and the lives of your family at risk, you're endangering the community and you're making it more difficult for us to protect the NHS and save lives. #StayHomeSaveLives https://t.co/WLw17OboHR;20-Mar-2020 (21:15:00.000000)
The more we follow the advice, the faster the country will stage both a medical and an economic recovery in full. #StayHomeSaveLives https://t.co/ik06dvasiH;20-Mar-2020 (19:45:18.000000)
We are supporting businesses and workers in a way that government has never done before. ////If people stay home, then we will not only save thousands of lives, but we will come out of this pandemic all the faster. #StayHomeSaveLives https://t.co/dhraP6OSfR;20-Mar-2020 (18:46:24.000000)
We are telling cafes, pubs, bars and restaurants to close tonight as soon as they reasonably can, and not to open tomorrow.////As far as possible we want you to stay at home.////That’s how we can protect our NHS and save lives.////➡ https://t.co/kdHUGOW5he https://t.co/8Hko4bfBnh;20-Mar-2020 (17:43:30.000000)
NHS staff are doing extraordinary work across the country to help our fight against coronavirus.////We now need to play our part in supporting them by following the government's guidance and working from home if you possibly can. https://t.co/90H9Qnw93l;20-Mar-2020 (13:20:22.000000)
We can beat this together, but only if we follow government advice and look out for each other. https://t.co/mavBWIHylf;20-Mar-2020 (08:00:00.000000)
Please be reasonable in your shopping, be considerate and thoughtful of others as you do it. https://t.co/Dwo7lTIkg7;19-Mar-2020 (20:05:47.000000)
Her Majesty The Queen speaks for us all. We all have a vital role to play. We will do whatever it takes to beat this together. https://t.co/k7VFionucj;19-Mar-2020 (19:19:42.000000)
I say to business, stand by your employees, stand by your workers, because we will stand by you.////I have absolutely no doubt that we will turn the tide of this disease and beat it together.////5/5;19-Mar-2020 (18:32:48.000000)
And it’s by this combination of ruthless, determined, collective action, and scientific progress, that we’re already seeing that we will succeed.////If we do this together, we will save many many thousands of lives.////4/5;19-Mar-2020 (18:32:48.000000)
It is absolutely vital that we follow the advice:////Stay at home if you have the symptoms, or if your family has the symptoms.////Avoid unnecessary contact.////Avoid pubs, bars and restaurants.////Work from home, if you possibly can.////And wash your hands.////3/5;19-Mar-2020 (18:32:47.000000)
We’re getting better at testing.////This crisis is so difficult because the enemy is invisible.////The answer is to remove the cloak of invisibility to identify the virus, and to be able to know which of us is carrying it and who has actually had it and got over it.////2/5;19-Mar-2020 (18:32:47.000000)
We can send #coronavirus packing in this country, but only if we take the required steps to reduce the peak.////Once we’ve achieved that, then the scientific progress that we are making will really come into play.////1/5;19-Mar-2020 (18:32:46.000000)
I want to say a huge thank you on behalf of the whole country to everyone working in our NHS, of every specialism and role, in our fight against the coronavirus pandemic. We’ve never needed you more than we do today.;19-Mar-2020 (16:44:29.000000)
We're going to step up testing for #coronavirus #COVID19 https://t.co/A7cNeBOd1J;19-Mar-2020 (07:46:24.000000)
The government has announced that schools will close from Monday https://t.co/C5RaaQPGnQ https://t.co/q3I54vQf1V;18-Mar-2020 (20:33:35.000000)
After schools shut their gates from Friday afternoon, they will remain closed for most pupils - for the vast majority of pupils - until further notice.// //Read more here: https://t.co/C5RaaQPGnQ https://t.co/5jMgPXxDML;18-Mar-2020 (20:06:53.000000)
WATCH: a message from @CMO_England on #coronavirus 👇////🏠If anyone in your household has coronavirus symptoms, you must all stay at home////❌ Do not visit your GP or local hospital////✅ Visit https://t.co/hmhS6y5caq to check symptoms and follow the advice https://t.co/v1zVKCKz8X;18-Mar-2020 (19:13:31.000000)
We have the resolve and the resources to win the fight against #Coronavirus https://t.co/g1SnxlMEzV;18-Mar-2020 (16:00:44.000000)
However tough the months ahead we have the resolve and the resources to win the fight.////And, to repeat, this government will do whatever it takes.////https://t.co/lg7axA86UB #COVID2019 https://t.co/Kfu8tFvCrM;18-Mar-2020 (07:33:09.000000)
I want to say a huge thank you on behalf of the whole country to everyone working in our NHS, for all your hard work at this difficult time. https://t.co/7hpUFMsfLw;17-Mar-2020 (21:31:41.000000)
“We will do whatever it takes.” – @RishiSunak #coronavirus https://t.co/rmCLPWvuWr;17-Mar-2020 (21:19:42.000000)
Use these trusted sources of information for the latest advice and guidance on #coronavirus////🩺 Check your symptoms: https://t.co/uL9bBXzV0F//🏥 Health guidance: https://t.co/47UIka9nis//ℹ All information on coronavirus: https://t.co/kdHUGOW5he https://t.co/vwKPJV2CII;17-Mar-2020 (16:45:05.000000)
Today the government has updated its travel guidance with immediate effect. ////We are now advising against all non-essential overseas travel.//https://t.co/Zdm45PKyuU;17-Mar-2020 (14:51:46.000000)
.@CMO_England Chris Whitty outlines how updated //#coronavirus advice will impact: ////▶️ People aged 70+//▶️ Adults who would normally be advised to have the flu vaccination//▶️ People with chronic diseases//▶️ Pregnant women////https://t.co/meymkGzBj3 https://t.co/DipjADBvOw;17-Mar-2020 (07:14:30.000000)
An update on the latest coronavirus advice. https://t.co/meymkGzBj3 https://t.co/qPAYFEpdCK;16-Mar-2020 (22:14:18.000000)
Latest NHS advice:////If you have: a new continuous cough OR a high temperature////You should stay at home for seven days.////Read the full guidance now: https://t.co/hmhS6y5caq https://t.co/v8oNM0UU2I;15-Mar-2020 (10:08:22.000000)
If you have: a new continuous cough OR a high temperature (37.8 degrees or higher), you should stay at home for 7 days.// //Read more here on how best to protect yourself and others whilst staying at home: https://t.co/P5Ch222CYT https://t.co/LsLU9wWqBL;14-Mar-2020 (12:00:12.000000)
If you have symptoms of coronavirus, it’s important that you stay at home for seven days to help protect your friends and neighbours.////More info: https://t.co/47UIka9nis https://t.co/lJyAoDgmcv;13-Mar-2020 (18:07:55.000000)
This country will get through this epidemic, just as it has got through many tougher experiences before. https://t.co/3KfFGyRWzA;13-Mar-2020 (07:24:21.000000)
The UK’s Chief Medical Officer on the government’s updated advice on #COVID19 ////If you have: a new continuous cough OR a high temperature (37.8 degrees or higher), you should stay at home for seven days.////Read the full guidance now: https://t.co/hmhS6y5caq https://t.co/BbSg7CbEmY;12-Mar-2020 (21:15:39.000000)
It is with deep sadness that I learned that a UK soldier was killed in the attack at the Taji military base last night. My thoughts go out to their loved ones at this extremely difficult time.;12-Mar-2020 (09:59:31.000000)
If you are unwell and think you might have coronavirus, stay at home and either call 111 or use the online service: https://t.co/xDm8Sg8LnS;11-Mar-2020 (15:25:20.000000)
Dr Jenny Harries, Deputy Chief Medical Officer, came into Downing Street to answer some of the most commonly asked questions on coronavirus. https://t.co/jByRhFFfat;11-Mar-2020 (15:23:07.000000)
It is absolutely critical in managing the spread of this virus that we take the right decisions at the right time, based on the latest and best evidence. https://t.co/8BbEeJ4dTb;09-Mar-2020 (18:50:03.000000)
Today I visited Worcestershire to see the recovery efforts and pay tribute to the emergency services following flooding. https://t.co/pF4iQXBSmP;08-Mar-2020 (16:15:40.000000)
Fantastic afternoon at Twickenham watching the rugby and congratulating the Red Roses on their recent victory. ////Congratulations @EnglandRugby and well played @WelshRugbyUnion! https://t.co/0wilNJXqJD;07-Mar-2020 (18:52:58.000000)
Today, two years on from the chemical attack in Salisbury, my thoughts remain with all those impacted. It is heartening to see the historic city welcoming visitors and looking to the future, thanks to the strength and character of the community.;04-Mar-2020 (08:29:02.000000)
An update on coronavirus following COBR. https://t.co/k34Q4XL4MF;02-Mar-2020 (14:46:25.000000)
Coronavirus may very well be a challenge in the weeks and months ahead.////But I have no doubt that with the help of the NHS and its ­incomparable staff, this country will get through it — and beat it.////https://t.co/r7LvqR9MuH;01-Mar-2020 (11:44:23.000000)
A huge win in Hillingdon East by-election - thanks to the @Hillingdon_Tory team for their hard work during the campaign. ////Colleen has already proven she’s a strong voice for local residents in Hillingdon and I know she’ll be a great addition to the fantastic team of councillors! https://t.co/aDKx6579nR;28-Feb-2020 (14:02:59.000000)
We want to end rough sleeping, help get people off the streets and provide them with the support and encouragement that they need. https://t.co/WMfg72hEa1;27-Feb-2020 (17:04:00.000000)
I was delighted to welcome the young winners of the 'Your NHS' art competition to Downing Street today. ////Their creative designs and visions for our NHS were spectacular. https://t.co/l5G5p4slUa;24-Feb-2020 (18:21:29.000000)
I'm deeply saddened to hear of the attack at the London Central Mosque. It's so awful that this should happen, especially in a place of worship. My thoughts are with the victim and all those affected.;20-Feb-2020 (16:52:35.000000)
My thoughts are with the people of Germany as they grieve those lost in the terrible attack in Hanau last night. ////The UK stands with our German friends against this racist assault on our values.;20-Feb-2020 (13:22:44.000000)
Next year, we will implement a points-based immigration system - welcoming the best and brightest from around the world whilst maintaining full control of our borders.  ////https://t.co/XFbjECICbD;19-Feb-2020 (17:36:00.000000)
We also agreed on the need to work together to tackle climate change, and resolved to strengthen our economic partnership. (2/2);18-Feb-2020 (13:49:20.000000)
This morning I spoke to Chinese President Xi to express my sympathy and support for those affected by the coronavirus outbreak. The UK government has donated vital medical equipment to the region and we will continue to offer our assistance. (1/2);18-Feb-2020 (13:49:07.000000)
We’re here to deliver for the people of this country. ////We're going to cut crime, we're going to tackle homelessness, and we’re going to invest more in our NHS and schools. https://t.co/DSuQLBPQRZ;14-Feb-2020 (12:37:13.000000)
This government will deliver on the priorities of the British people.// //Investing more in our NHS and schools, levelling up with better infrastructure, and tackling crime with 20,000 more police on the streets. https://t.co/vMz7O9cXtO;14-Feb-2020 (12:10:16.000000)
We’re going to unite and level up across the country with better rail, less congested roads and beautiful British-build buses - making travel cleaner, greener, quicker, safer and more frequent. // //https://t.co/ombj6Bb0s9;12-Feb-2020 (07:35:00.000000)
Fantastic to visit HS2’s Birmingham Curzon Street site this afternoon. ////This project will deliver better, faster and more reliable transport connections across the country. https://t.co/5T53bNMXoT;11-Feb-2020 (20:03:00.000000)
HS2 is going to be a truly fantastic opportunity for Birmingham, the Midlands and for the whole country. https://t.co/g4J47XEtXw;11-Feb-2020 (19:00:00.000000)
.@KarenPierceUN is an outstanding and accomplished diplomat and I can think of no better person to drive forward our hugely important relationship with the United States at this time. I’m delighted she’ll be representing us in Washington.;07-Feb-2020 (11:50:29.000000)
We’re increasing our support for military veterans. ////https://t.co/n9LYBGjDry;06-Feb-2020 (16:14:29.000000)
We are shortly bringing forward legislation to end the automatic early release of terrorist offenders. #PeoplesPMQs https://t.co/KMOttaHiP0;06-Feb-2020 (12:06:47.000000)
We're transforming mental health services for children and young people – putting in the money and resources so every child can get the support they need.// //#ChildrensMentalHealthWeek https://t.co/sVHXhqlbOe;06-Feb-2020 (07:29:00.000000)
WATCH LIVE: I answer your questions #PeoplesPMQs #PPMQs https://t.co/r836l07xpy;05-Feb-2020 (17:01:42.000000)
Let’s make this year the moment when we come together with the courage and the technological ambition to solve man-made climate change and to choose a cleaner, greener future for all our children and grandchildren. https://t.co/wuFS5z2cFY;04-Feb-2020 (19:35:00.000000)
🎙 I’m hosting another #PeoplesPMQs tomorrow night at 5pm. // //💬 Send me your questions here: https://t.co/f85fLz0f4z https://t.co/NpVYMUHom7;04-Feb-2020 (18:10:36.000000)
Delighted to launch the UN Climate Summit //@COP26 with Sir David Attenborough at the //@sciencemuseum this morning. ////There is no greater responsibility than protecting our planet, and no mission that a Global Britain is prouder to serve. https://t.co/iBgkYuTetm;04-Feb-2020 (11:59:53.000000)
We are re-emerging, after decades of hibernation, as a campaigner for global free trade 🇬🇧🌏 https://t.co/zos7YKVCvd;03-Feb-2020 (20:31:32.000000)
Thank you to all emergency services responding to the incident in Streatham, which the police have now declared as terrorism-related. My thoughts are with the injured and all those affected.;02-Feb-2020 (16:03:18.000000)
Thank you to @SteveBarclay, @LordCallanan, @JamesDuddridge and to everyone at DExEU for all of your hard work and dedication in getting Brexit delivered.;01-Feb-2020 (21:41:35.000000)
As we embark on a new chapter, let's come together and build a brighter future for the next generation. https://t.co/0VHVPfv5sp;01-Feb-2020 (10:15:00.000000)
Tonight we have left the EU - an extraordinary turning point in the life of this country. Let us come together now to make the most of all the opportunities Brexit will bring - and let’s unleash the potential of the whole UK. 🇬🇧;31-Jan-2020 (23:00:58.000000)
