Full Text Tweet;Datum und Uhrzeit
Warm welcome at Whelan’s yesterday! Great community pub in the centre of Uxbridge. Superb renovation - Austin and his team have done a top job! https://t.co/88kKMcTI0k;25-Nov-2017 (11:15:16.000000)
First @TovertafelUK in a library right here in Uxbridge! More on the way for @Hill_libraries - fantastic to see it in action! https://t.co/SjmktGrXFq;24-Nov-2017 (15:33:07.000000)
Deeply saddened by the abhorrent attack on a mosque in North Sinai, #Egypt. My sincere condolences to all those affected by such a barbaric act.;24-Nov-2017 (13:48:23.000000)
Good to meet my friend @sigmargabriel courtesy of @RAFNortholt today.  Good discussions on Iran, Syria, and Yemen - and much else too. @AuswaertigesAmt @UKinGermany https://t.co/bM0eQGGpvb;24-Nov-2017 (12:33:08.000000)
"Spoke to Saudi Crown Prince Mohammed bin Salman on urgency of humanitarian situation in Yemen. Stressed need for immediate humanitarian access into Hodeidah port &amp; opening Sana’a airport to UN flights. But famine won’t be averted without commercial imports into all of Yemen";23-Nov-2017 (22:03:23.000000)
Those who perpetrate atrocities cannot escape justice. Ratko Mladic conviction for genocide in Srebrenica will not bring back the thousands of lost lives, but I hope it will bring some peace to those who still suffer as a result of his actions;22-Nov-2017 (15:31:30.000000)
Tories continue to be party of homeownership with stamp duty cut and £44bn for house building plan, while maintaining strong public finances. Great #budget2017 from @PhilipHammondUK.;22-Nov-2017 (15:14:20.000000)
I will not pretend to regret Mugabe’s downfall. Today is a moment of hope for the people of Zimbabwe. The UK will support them. https://t.co/AHyW5yHM30;21-Nov-2017 (18:17:43.000000)
Today welcomed Kazakh Foreign Minister Kairat Abdrakhmanov to London. Kazakhstan will be the first Central Asian nation to chair #UNSC. Looking forward to further cooperation on global security. https://t.co/JneTk6iCqW;20-Nov-2017 (17:10:02.000000)
"Appalled by 3rd Russian veto of impartial &amp; expert international investigation into chemical weapons use in #Syria. UK will not let the end of Joint Investigative Mechanism stop work with intl partners to hold to account those responsible for CW use";18-Nov-2017 (12:05:11.000000)
🇬🇧-🇮🇪 relations going from strength to strength. Saw full breadth of relationship in #Dublin inc the young people ensuring our friendship endures long into the future @tcddublin @BTYSTE https://t.co/AiuZuxZN5l;17-Nov-2017 (19:29:27.000000)
Great to visit Irish foreign minister @simoncoveney in Dublin to discuss joint priorities, particularly peacebuilding in Middle East and Africa. 🇬🇧-🇮🇪 friendship will get even better in coming years https://t.co/4MOjHX3JMS;17-Nov-2017 (12:34:44.000000)
Great to see Australia vote overwhelmingly in favour of #marriageequality Everyone should be free to express their love in the way that they choose;15-Nov-2017 (17:26:14.000000)
Constructive call just now with South African Deputy President Ramaphosa – UK and SA agree Zimbabweans must be able to decide their own future in free and fair elections in line with constitution. Authoritarian rule should have no place in Africa;15-Nov-2017 (17:02:23.000000)
"Good meeting with @Gebran_Bassil. Reiterated UK support for Lebanon’s sovereignty, stability &amp; independence. We hope that PM Hariri will return to Beirut soon and we urge all those with an interest in Lebanon to encourage this and to work more broadly to reduce tensions. https://t.co/eI0orREQXU";15-Nov-2017 (16:24:46.000000)
Had a positive meeting with Richard Ratcliffe about UK efforts to help his wife Nazanin. We will continue to leave no stone unturned in our work on all our Iranian consular cases https://t.co/CIPXx4mq81 https://t.co/VSI2PEmsdQ;15-Nov-2017 (15:48:30.000000)
"We are monitoring events in #Zimbabwe closely and embassy staff are on hand providing support to Brits. Urge those in country to follow travel advice &amp; remain at home or in accommodation until situation is clearer https://t.co/SGxvgyURXO";15-Nov-2017 (11:22:58.000000)
Discussing Iran deal, Middle East developments, and agreeing new sanctions regime on Venezuela, in Brussels with EU foreign ministers today https://t.co/bo6yZ7IQCY;13-Nov-2017 (12:20:59.000000)
Deepest condolences with the people of Iran and Iraq following last night’s deadly earthquake. The UK stands ready to help the victims and the recovery effort;13-Nov-2017 (10:44:54.000000)
Today we remember those who sacrificed so much to protect the freedoms we take for granted. We must never forget those brave men and women #RemembranceSunday https://t.co/rcAgtgB2Gb;12-Nov-2017 (10:44:08.000000)
My very best wishes to all those celebrating 99 years of Polish independence today. UK has historic ties with this great ally and today's relationship is stronger than ever;11-Nov-2017 (19:00:49.000000)
"A free &amp; vibrant press is essential for democracy. Pleasure to meet @washingtonpost journalists &amp; CEO Fred Ryan on visit to their newsroom https://t.co/f9ZPd8V9vF";09-Nov-2017 (23:23:10.000000)
"Reminded of the strength of 🇬🇧 - 🇺🇸 special relationship in excellent talks w/ @SenBobCorker &amp; @SenateMajLdr on concerns inc #Iran deal https://t.co/31z1xUxMIg";09-Nov-2017 (02:45:55.000000)
"Grateful for warm welcome from @SpeakerRyan. Talks included benefits of #Iran deal &amp; curbing regional destabilisation https://t.co/QBScXLzyIG";09-Nov-2017 (00:31:48.000000)
"Great to catch up w/ @GOPLeader Kevin McCarthy about maintaining the #Iran Deal, confronting North Korea &amp; making a success of Brexit https://t.co/vBgOFk5HSq";08-Nov-2017 (20:35:04.000000)
In 🇺🇸 for talks w/ US Congress leadership to underline benefits of #Iran nuclear deal while not being complacent about Iranian disruption;08-Nov-2017 (19:05:53.000000)
Historic @UN Security Council statement on terrible #Rakhine situation. Burma military leaders must ensure aid reaches those who need it;06-Nov-2017 (20:58:57.000000)
Horrified by news of the shooting in Sutherland Springs, Texas. My thoughts are w/ the US and everyone affected by this tragedy.;05-Nov-2017 (22:56:00.000000)
"I strongly condemn attempted missile strike on Riyadh &amp; deliberate targeting of civilians. 🇬🇧 stands w/ 🇸🇦 in tackling security threats";05-Nov-2017 (11:09:36.000000)
Thanks to all involved with launching South Ruislip Chamber of Commerce - a top effort and a strong voice for businesses in the area https://t.co/kxcDQUEAEY;03-Nov-2017 (17:41:40.000000)
Queens Walk Resource Centre is a real credit to @Hillingdon - pleased to see so many enjoying its state of the art facilities https://t.co/IV4Ne462hB;03-Nov-2017 (16:27:54.000000)
Thanks to Fiona and her team at the Tudor Club - delicious lunch! Important social club for the local community. https://t.co/aPak5PeWYR;03-Nov-2017 (15:44:40.000000)
Superb facilities for two top teams! Bessingby and Deane Park Bowls Clubs making full use of facilities provided by @Hillingdon https://t.co/G8185IXTa2;03-Nov-2017 (14:21:03.000000)
Delighted to pop in for tea at Whitby Dene - great team looking after all the residents! https://t.co/nuoAFJmMdQ;03-Nov-2017 (13:51:03.000000)
".@Patel4witham is a good friend &amp; we work closely together for GLOBAL BRITAIN. Quite right that she meets w/ people &amp; organisations overseas";03-Nov-2017 (11:56:48.000000)
.@SecretaryRoss and I discussed the importance of a 🇬🇧- 🇺🇸 trade deal and the exciting opportunities it will present.;02-Nov-2017 (20:41:41.000000)
Just met US Commerce @SecretaryRoss. I made clear the UK’s unwavering commitment to Bombardier and the security of 4,000 jobs in NI.;02-Nov-2017 (20:39:52.000000)
Very disappointed and mystified at closure of Uxbridge Police Station. Fully support Hillingdon Conservative’s call for rethink https://t.co/DeMfhgQHBN;02-Nov-2017 (19:23:26.000000)
Pleased to announce new free speech funding. Vital we work to #EndImpunity for crimes against journalists: https://t.co/MTxUh2uoqU https://t.co/uvEB3QBxAa;02-Nov-2017 (13:24:21.000000)
UK stands united w/ US friends following the horrific #NYC attack. My thoughts are w/ everyone affected. We will not give in to terror.;31-Oct-2017 (22:56:06.000000)
Just spoken w/ Qatar FM @MBA_AlThani_ to reiterate support for Gulf unity and Kuwaiti mediation to resolve dispute/de-escalate tensions;31-Oct-2017 (15:18:44.000000)
But there is still more to do to get our Overseas Territories back on their feet – our response continues (2/2);31-Oct-2017 (14:01:42.000000)
Today I thanked some of the excellent UK Govt staff who responded to Caribbean hurricane crisis (1/2) https://t.co/07nSv9HMcH;31-Oct-2017 (14:01:22.000000)
"Excellent first call w/ new Netherlands FM @HalbeZijlstra. UK &amp; Netherlands are great friends &amp; partners";31-Oct-2017 (13:40:56.000000)
"Spoke w/ #Palestinian FM Riyad al Malki. Discussed UK marking #Balfour w/ sensitivity &amp; balance and our commitment to a two state solution.";30-Oct-2017 (19:50:59.000000)
"First call w/new @NorwayMFA FM Ine Eriksen Søreide. Agreed to build on strong ties w/ North Sea friends &amp; look forward to our🎄in December!";30-Oct-2017 (13:32:21.000000)
Appalled by al-Shabaab attack in #Mogadishu. More innocent lives lost so soon after 14 October atrocities. UK stands with #Somalia;28-Oct-2017 (19:47:29.000000)
DPRK, Syria, Iran some of the global security issues on the agenda in Paris tonight at dinner with French FM @JY_LeDrian https://t.co/ZQY2a2LKoP;27-Oct-2017 (19:49:14.000000)
Great talks in Lisbon w/my friend FM Santos Silva on celebrating our #AncientAlliance, intensifying our #ModernAlliance @nestrangeiro_pt https://t.co/VU2C447heK;27-Oct-2017 (11:55:12.000000)
Lively Q+A with NURA. Discussing the plans to close Uxbridge police station, HS2 + pleased to assure no increase to cap @RAFNortholt https://t.co/nKK2cVkSO7;26-Oct-2017 (21:01:23.000000)
Welcome release from custody of human rights defenders inc @amnesty activists in Turkey yesterday. Hope for speedy resolution to the case;26-Oct-2017 (13:49:27.000000)
Proud of UK's leading role in protecting the oceans. Vital to the health of our planet #backthebluebelt #UKBlueBelt https://t.co/nl3BIMyksN;25-Oct-2017 (18:46:17.000000)
Fantastic to attend @RichardBenyonMP's Blue Belt reception tonight, highlighting the importance of marine conservation;25-Oct-2017 (18:43:41.000000)
Spoke w/Turkish FM @MevlutCavusoglu about Iraq. Also expressed UK's serious concern over detained @amnesty human rights defenders;24-Oct-2017 (20:07:16.000000)
Russian veto stops UN investigators attributing responsibility for chemical weapons use. But it won't stop UK working to get victims justice;24-Oct-2017 (17:41:07.000000)
The @UN represents the best hope for a peaceful world. Proud of UK's role in its creation and continued efforts to uphold its ideals. #UNDay https://t.co/jEqP6MLKPm;24-Oct-2017 (13:26:54.000000)
United by our strong democratic values. Invaluable to share thoughts with my friend @JanelidzeMkh on huge potential of UK-Georgia relations https://t.co/i0DLg1EkyP;23-Oct-2017 (21:06:35.000000)
"Warm congratulations to @AbeShinzo on his election success. I look forward to further strengthening ties. UK &amp; Japan are natural partners";23-Oct-2017 (15:52:16.000000)
In uncertain times such as these, diplomacy is more important than ever. Read my #CHLondon speech on global security https://t.co/y2kl1SNxoS https://t.co/RukXB7jUQr;23-Oct-2017 (13:44:05.000000)
I condemn the despicable terrorist killings in El Wahat and send my condolences to all Egyptians affected. The UK stands together w/ #Egypt;21-Oct-2017 (18:30:57.000000)
Congratulations to @IEriksenSoreide on appointment as new Foreign Minister of #Norway. Look forward to working together.;20-Oct-2017 (17:03:47.000000)
I welcome the @coalition announcement of the liberation of #Raqqa, a momentous moment in the fight against Daesh. https://t.co/H5E94LDK6n;20-Oct-2017 (14:18:54.000000)
Folks ignore the gloomadon-poppers - here's my friend the Mexican foreign minister @LVidegaray earlier today https://t.co/SMC7CjHmdp;19-Oct-2017 (18:41:16.000000)
"Great talks with @LVidegaray today. Mexico is a key partner for UK. Huge potential for further cooperation in energy, finance &amp; education https://t.co/6cTnPXDGyb";19-Oct-2017 (14:39:53.000000)
With EU foreign ministers today to sign off on new sanctions against #NorthKorea and discuss UK support for Iran Deal https://t.co/RncHvCpaFS;16-Oct-2017 (16:00:20.000000)
Congratulations to my friend Sebastian Kurz on first place in #Austrianelections. Huge personal achievement;16-Oct-2017 (15:13:32.000000)
"UK condemns #Somalia terror attack. My thoughts are w/ victims, their families &amp; the people of Somalia at this difficult time @UKinSomalia";15-Oct-2017 (19:14:03.000000)
Hosted talks today at #Chevening w/ counterparts from 8 EU partners 🇧🇬 🇭🇷 🇨🇿 🇭🇺 🇵🇱 🇷🇴 🇸🇰 🇸🇮 on European security ahead of #FAC tomorrow https://t.co/qGb6cdCtsA;15-Oct-2017 (16:46:36.000000)
Delighted to join Ruislip Manor Library’s 10th birthday party! Here's to many more! @Hill_libraries https://t.co/Apw1cOYPKf;14-Oct-2017 (11:19:45.000000)
"UK committed to Iran nuclear deal. Will be engaging with US, European, &amp; Iranian counterparts to preserve the deal. https://t.co/5cQBWXrWJo";13-Oct-2017 (18:45:33.000000)
Great to see @Barclays Digital Safety team in Uxbridge today to discuss tackling cyber crime, protecting identities and staying safe online. https://t.co/38ZNJJ9t2P;13-Oct-2017 (14:26:32.000000)
"Pleasure to host UK-Poland talks, alongside Defence Secretary Fallon, w/ our friends &amp; counterparts Witold Waszczykowski &amp; @Macierewicz_A https://t.co/trb7n5fOhO";12-Oct-2017 (17:39:25.000000)
"Held talks w/ Iranian VP Ali Akbar Salehi. UK strives to preserve nuclear deal but #Iran must play its part &amp; curb disruptive regional role https://t.co/ThGzv1tLAe";11-Oct-2017 (12:20:58.000000)
"Spoke to @JZarif. UK committed to Iran nuclear deal &amp; I underlined serious concern for dual national detainees inc Nazanin Zaghari-Ratcliffe";10-Oct-2017 (18:30:16.000000)
"#UNSC endorsing @GhassanSalame Action Plan is important step for peace &amp; security in #Libya. UK backs UN efforts to end Libyans’ suffering";10-Oct-2017 (17:10:53.000000)
Great statement by the PM. Powerful vision. Future is bright #brexit https://t.co/55Gxoy7vOj;09-Oct-2017 (18:02:26.000000)
Royal Messengers have delivered the diplomatic bag since medieval times. Honour to meet their modern day Queen's Messenger 🇬🇧 counterparts https://t.co/hrjNt2R9Uu;09-Oct-2017 (17:40:51.000000)
New #tradepaper brings us one step closer to an independent UK trade policy. Full steam ahead Global Britain https://t.co/qH7Rz37jKK;09-Oct-2017 (17:27:58.000000)
Great to meet #Uruguay foreign minister Rodolfo Nin Novoa today. Our talks covered trade and opportunities for closer UK-#Uruguay ties;09-Oct-2017 (13:57:01.000000)
"Welcomed #Tunisia FM @Jhinaoui_MAE to London to discuss UK-Tunisia relations &amp; continued cooperation on security, counterterrorism &amp; trade https://t.co/AMvmcc7C8M";09-Oct-2017 (11:57:52.000000)
New consultation on banning #ivory sales in UK is a significant step in ending #wildlifetrafficking;06-Oct-2017 (08:27:18.000000)
"Great to see my friend Austrian Foreign Minister @sebastiankurz in London for talks on strong UK-#Austria ties &amp; shared challenges https://t.co/sjtpEDFHtL";04-Oct-2017 (18:27:39.000000)
Great job by the PM today putting housing at the heart of renewing the British dream;04-Oct-2017 (15:19:22.000000)
That's why Britain is playing a key role in reconstruction and why I have visited Libya twice this year in support;03-Oct-2017 (22:58:31.000000)
The reality there is that the clearing of corpses of Daesh fighters has been made much more difficult by IEDs and booby traps;03-Oct-2017 (22:58:11.000000)
Shame people with no knowledge or understanding of Libya want to play politics with the appallingly dangerous reality in Sirte;03-Oct-2017 (22:57:48.000000)
Horrified by awful and indiscriminate Las Vegas attack. Thoughts with all those affected. Urgently establishing if Brits involved.;02-Oct-2017 (11:21:32.000000)
Spain is a close ally and a good friend, whose strength and unity matters to the UK. (2/2);01-Oct-2017 (19:49:51.000000)
"The Catalonian referendum is a matter for the Spanish govt &amp; people. Imp that Spanish constitution respected &amp; the rule of law upheld. (1/2)";01-Oct-2017 (19:49:21.000000)
#uselessSadiq plans to close Uxbridge Police Station. Hillingdon Council says he is wrong and so do I. https://t.co/nMmJSlUVCz;28-Sep-2017 (16:15:09.000000)
Welcome Saudi decision to allow women to drive. Big step forward for women's rights. Look forward to more social reform in the future;27-Sep-2017 (08:24:51.000000)
Hi folks, good conversations here in Bratislava as we look to get negotiations moving into their second phase. https://t.co/JBZvvhyfJ3;26-Sep-2017 (12:47:50.000000)
Met Slovakian PM @RobertFico and DFM @ivankorcok today in #Bratislava to talk EU exit and opportunities for closer UK-Slovakia ties https://t.co/piDx3zmAj4;26-Sep-2017 (10:58:00.000000)
In Bucharest tonight to assure Romanian FM @teodormelescanu that UK-Romanian ties will be even stronger after we leave the EU @MEARomania https://t.co/tdBpj0BOEs;25-Sep-2017 (18:37:29.000000)
Just in Prague to speak to my counterpart @ZaoralekL about the PM's Florence speech. Now off to Romania. https://t.co/fM2R7uTYOB;25-Sep-2017 (14:10:04.000000)
Great to be back in #Prague to talk defence and security, trade, and the future of Europe with Czech FM @ZaoralekL @CzechMFA https://t.co/0Ew96jOjGn;25-Sep-2017 (13:11:22.000000)
"Kurdish referendum: I urge all parties to remain calm &amp; work together to defeat Daesh. Iraq’s future lies in dialogue. UK ready to help";25-Sep-2017 (12:15:16.000000)
Extremely concerned by reports of Iran missile test, which is inconsistent with UN resolution 2231. Call on Iran to halt provocative acts;23-Sep-2017 (11:35:55.000000)
And we will take back control of money borders laws!;22-Sep-2017 (14:56:16.000000)
A strong Britain working hand in hand with a strong Europe - but once again free to take our own decisions;22-Sep-2017 (14:25:23.000000)
"PM speech was positive, optimistic &amp; dynamic - and rightly disposes of the Norway option! Forwards!";22-Sep-2017 (14:23:51.000000)
Great to catch up with @LdeRothschild to discuss gender equality. When you have equality in the workforce, companies will be more dynamic. https://t.co/0WAiBhk68R;20-Sep-2017 (19:53:12.000000)
"My deepest condolences to #Mexico earthquake victims &amp; their loved ones. UK stands ready to help our Mexican friends at this difficult time";20-Sep-2017 (02:38:09.000000)
Met with Chinese Foreign Minister Wang Yi earlier to urge him to keep up the pressure on North Korea. China has a vital role to play.  #UNGA https://t.co/WNWDRbcjTQ;19-Sep-2017 (22:21:03.000000)
Hi folks, a quick clip from the UN General Assembly in New York where Global Britain is in action and at the forefront of tackling issues https://t.co/T9LevZDvgF;19-Sep-2017 (16:59:17.000000)
Great to catch up with my Japanese counterpart Minister Kono to discuss North Korea and opportunities for even more trade in the future 🇬🇧🇯🇵 https://t.co/cfpTmOGPFS;19-Sep-2017 (13:50:58.000000)
UK-led #Burma meeting on #UNGA margins delivered uncompromising messages to Burmese govt: stop killings, grant aid access, uphold rights. https://t.co/DJTk0j5vK3;18-Sep-2017 (20:43:49.000000)
UK making full #HurricaneMaria preparations. COBR emergency ctte met earlier under @DamianGreen to ensure all necessary being done;18-Sep-2017 (17:35:52.000000)
"Hosted talks @UN w/ FR FM @JY_LeDrian, NL FM Koenders &amp; Caribbean counterparts on Hurricane #Irma aftermath &amp; need to intensify cooperation https://t.co/y4Ew3FiyDF";18-Sep-2017 (17:27:33.000000)
"In NYC for #UN General Assembly week, a valuable opportunity to get together &amp; address global challenges. @UKUN_NewYork @UKinNewYork";18-Sep-2017 (17:15:19.000000)
Looking forward to PM's Florence speech. All behind Theresa for a glorious Brexit: https://t.co/5pe1pY2m13;16-Sep-2017 (11:05:27.000000)
Yet another illegal missile launch by North Korea. UK and international community will stand together in the face of these provocations.;15-Sep-2017 (06:50:02.000000)
"Deeply moved by my visit to #BVI &amp; meeting such resilient/inspiring people. Help has arrived &amp; more on way. UK will not let you down. https://t.co/dxgiHCIMvv";13-Sep-2017 (21:23:45.000000)
"#BVI Premier @D_OrlandoSmith &amp; Governor @GusJaspert are working together w/ firm &amp; urgent 🇬🇧 support to help those in need after #Irma https://t.co/6sOoOlqMAk";13-Sep-2017 (18:23:37.000000)
BVI is a scene of utter devastation. I've never seen anything like it. The courage of everyone here is incredible. #BVIstrong https://t.co/slKtDhy6zT;13-Sep-2017 (16:29:33.000000)
"At #Anguilla Hospital seeing the #Irma damage &amp; meeting the locals/UK troops repairing it. UK behind the British Overseas Territories 100%. https://t.co/UyDQLzDubm";13-Sep-2017 (13:30:32.000000)
"Held talks w/ #Anguilla Chief Minister Victor Banks on further support. He thanked UK for reacting ""within hours"" of #Irma passing.";13-Sep-2017 (10:47:09.000000)
"Seen for myself #Irma damage on Anguilla &amp; extraordinary efforts of local people supported by UK response to recover &amp; get back to normality";13-Sep-2017 (02:19:07.000000)
"In #Bridgetown meeting some of the 1,000 🇬🇧 servicemen/women working night &amp; day to bring relief to British Overseas Territories after #Irma https://t.co/pfZjUSBTkI";12-Sep-2017 (20:09:14.000000)
Just chaired latest #HurricaneIrma COBR. UK gov't continues to work around the clock to help get the Overseas Territories back on their feet https://t.co/JcJYrSdYV1;11-Sep-2017 (18:56:08.000000)
Agreed w/ Dutch FM Bert Koenders our 2 countries will continue to work together closely to assist UK/NL nationals in urgent need after #Irma;11-Sep-2017 (14:55:02.000000)
"Spoken w/ Tim Foy, Governor of #Anguilla. RFA Mounts Bay returns there tonight w/ fresh supplies; RAF today deploying further 🇬🇧 personnel.";11-Sep-2017 (14:37:37.000000)
Spoken to BVI Governor @GusJaspert. We have 500+ troops in the region, 3 more flights today. Priority is getting aid to BVI and Anguilla;10-Sep-2017 (18:28:57.000000)
Just back from COBR meeting. UK continues to ramp up its humanitarian response to #HurricaneIrma to help those affected by this catastrophe https://t.co/u442jTtoLA;10-Sep-2017 (18:12:46.000000)
Just spoken to Barbados PM Freundel Stuart, thanked him for phenomenal support for UK humanitarian aid. #HurricaneIrma;10-Sep-2017 (15:20:00.000000)
I’ve just called @KimDarroch and @DaveProdgerFCO – our team in US – to make sure we’re doing all we can for British nationals in #Florida;10-Sep-2017 (14:15:21.000000)
In the FCO crisis centre last night. #UKaid will double your support to the @BritishRedCross #HurricaneIrma appeal: https://t.co/d3EOB7pnCM https://t.co/9hT0sfIOE3;10-Sep-2017 (12:19:07.000000)
Thoughts with British nationals in #Florida as #HurricaneIrma approaches. ////Please follow local guidance https://t.co/BuCtpTjGC1;10-Sep-2017 (11:37:25.000000)
"Spoken to @FLGovScott for latest ahead of #HurricaneIrma. Thoughts are w/ all in Florida &amp; others already affected by the devastation.";09-Sep-2017 (15:34:55.000000)
The UK is absolutely determined to do everything we can to help those affected by Hurricane Irma to get back on their feet. https://t.co/YVW5CyZF2t;08-Sep-2017 (20:18:07.000000)
"Useful talks on North Korea &amp; Middle East w/ EU Foreign Ministers in Estonia. Working hard for solutions to shared issues https://t.co/umxIsjMwZ3";07-Sep-2017 (19:40:55.000000)
I spoke to ASSK today. Raised strong UK concerns about #Rakhine. We agreed any human rights abuses must be investigated urgently.;07-Sep-2017 (16:11:00.000000)
My thoughts are with all those dealing with terrible impact of Hurricane Irma. UK has taken swift action and is providing support https://t.co/C1FWNkhLO2;07-Sep-2017 (10:32:39.000000)
"Just spoke to Anguilla’s Chief Minister on #HurricaneIrma. UK providing support &amp; urge Brits to follow travel advice https://t.co/CkU52Ikmvm";06-Sep-2017 (21:39:24.000000)
UK commitment to European security is unbreakable. Pleasure hosting 8 Nordic/Baltic foreign ministers in London to discuss shared challenges https://t.co/FTkccJJtQy;04-Sep-2017 (19:38:06.000000)
UK military is helping Nigerian Navy to tackle piracy in Gulf of Guinea. Fantastic to meet great UK servicemen providing invaluable training https://t.co/cY1loshRZT;31-Aug-2017 (22:16:59.000000)
Our new UK High Commission building in Nigeria - bringing @foreignoffice @DFID_UK @DefenceHQ under one roof - is now officially open. #1HMG https://t.co/r22hPO8uJK;31-Aug-2017 (21:58:10.000000)
"#Diageo's #Guinness brewery in Lagos is symbol of 🇬🇧- 🇳🇬 trade w/ barley coming from UK &amp; tasty Foreign Extra Stout heading out to the world https://t.co/oudWAblMPT";31-Aug-2017 (17:24:21.000000)
"True honour to dedicate new #Commonwealth war memorial in Abuja to the thousands of Nigerians who fought alongside 🇬🇧 in WW1 &amp; WW2 https://t.co/OBHWL8R7tg";31-Aug-2017 (17:20:35.000000)
"In north east #Nigeria w/ @patel4witham seeing the big impact of 🇬🇧 military training &amp; humanitarian aid on the front line w/vile Boko Haram https://t.co/KXXQoMt61Y";30-Aug-2017 (19:20:00.000000)
Fantastic to welcome new @USAmbUK Woody Johnson to @foreignoffice earlier. Look forward to working together to strengthen UK/US relationship https://t.co/oXvArdBXkt;29-Aug-2017 (17:42:31.000000)
